root@lamp-ubuntu-s-1vcpu-1gb-tor1-01:~# tcpdump -c 5 -i eth0
tcpdump: verbose output suppressed, use -v or -vv for full protocol decode
listening on eth0, link-type EN10MB (Ethernet), capture size 262144 bytes
22:43:13.672282 IP 165.227.35.201.ssh > bras-base-toroon1016w-grc-23-184-148-159-239.dsl.bell.ca.64015: Flags [P.], seq 1432388616:1432388724, ack 1734754971, win 501, length 108
22:43:13.672345 IP 165.227.35.201.ssh > bras-base-toroon1016w-grc-23-184-148-159-239.dsl.bell.ca.64015: Flags [P.], seq 108:144, ack 1, win 501, length 36
22:43:13.672383 IP 165.227.35.201.ssh > bras-base-toroon1016w-grc-23-184-148-159-239.dsl.bell.ca.64015: Flags [P.], seq 144:252, ack 1, win 501, length 108
22:43:13.672410 IP 165.227.35.201.ssh > bras-base-toroon1016w-grc-23-184-148-159-239.dsl.bell.ca.64015: Flags [P.], seq 252:288, ack 1, win 501, length 36
22:43:13.672717 IP 165.227.35.201.42316 > dns.google.domain: 5973+ PTR? 239.159.148.184.in-addr.arpa. (46)
5 packets captured
22 packets received by filter
0 packets dropped by kernel
