^C8 packets captured
10 packets received by filter
0 packets dropped by kernel
root@lamp-ubuntu-s-1vcpu-1gb-tor1-01:~# tcpdump -r 0001.pcap
reading from file 0001.pcap, link-type EN10MB (Ethernet)
22:45:31.917580 IP 165.227.35.201.ssh > bras-base-toroon1016w-grc-23-184-148-159-239.dsl.bell.ca.64015: Flags [P.], seq 1472412988:1472413032, ack 1734781199, win 501, length 44
22:45:31.917654 IP 165.227.35.201.ssh > bras-base-toroon1016w-grc-23-184-148-159-239.dsl.bell.ca.64015: Flags [P.], seq 44:152, ack 1, win 501, length 108
22:45:31.917701 IP 165.227.35.201.ssh > bras-base-toroon1016w-grc-23-184-148-159-239.dsl.bell.ca.64015: Flags [P.], seq 152:188, ack 1, win 501, length 36
22:45:31.927036 IP bras-base-toroon1016w-grc-23-184-148-159-239.dsl.bell.ca.64015 > 165.227.35.201.ssh: Flags [.], ack 188, win 4162, length 0
22:45:33.812402 IP 165.227.35.201.ssh > 49.88.112.71.50123: Flags [P.], seq 1983252813:1983253869, ack 2560792440, win 504, options [nop,nop,TS val 590433575 ecr 601936311], length 1056
22:45:35.288436 IP 45.145.66.90.56585 > 165.227.35.201.22222: Flags [S], seq 856652211, win 1024, length 0
22:45:40.980416 IP 165.227.35.201.ssh > 49.88.112.71.58931: Flags [P.], seq 1437063454:1437064510, ack 2957278763, win 504, options [nop,nop,TS val 590440743 ecr 601953849], length 1056
22:45:43.344235 IP 45.145.67.74.40550 > 165.227.35.201.9988: Flags [S], seq 170628879, win 1024, length 0
