3788, win 4158, length 0
22:46:39.661396 IP 184.148.159.239.64015 > 165.227.35.201.22: Flags [.], ack 5854116, win 4163, length 0
22:46:39.661396 IP 184.148.159.239.64015 > 165.227.35.201.22: Flags [.], ack 5854280, win 4162, length 0
22:46:39.661396 IP 184.148.159.239.64015 > 165.227.35.201.22: Flags [.], ack 5854936, win 4159, length 0
22:46:39.661396 IP 184.148.159.239.64015 > 165.227.35.201.22: Flags [.], ack 5855264, win 4158, length 0
22:46:39.661396 IP 184.148.159.239.64015 > 165.227.35.201.22: Flags [.], ack 5855592, win 4163, length 0
22:46:39.661445 IP 184.148.159.239.64015 > 165.227.35.201.22: Flags [.], ack 5855920, win 4161, length 0
22:46:39.661445 IP 184.148.159.239.64015 > 165.227.35.201.22: Flags [.], ack 5856576, win 4159, length 0
22:46:39.661445 IP 184.148.159.239.64015 > 165.227.35.201.22: Flags [.], ack 5857232, win 4163, length 0
22:46:39.661445 IP 184.148.159.239.64015 > 165.227.35.201.22: Flags [P.], seq 3385:3421, ack 5857396, win 4162, length 36
^C
39431 packets captured
39431 packets received by filter
0 packets dropped by kernel
